{
  "manifest_version": "2.0.0",
  "project_id": "prj_canonical_01",
  "created_at": "2026-09-28T12:00:00Z",
  "assets": [
    {
      "asset_id": "ast_video_hero",
      "kind": "video",
      "provenance": "user_upload",
      "status": "ready",
      "source_path": "assets/ready/hero1.mp4",
      "processed_path": "assets/ready/hero1_norm.mp4"
    },
    {
      "asset_id": "ast_video_hero",
      "kind": "video",
      "provenance": "user_upload",
      "status": "ready",
      "source_path": "assets/ready/hero2.mp4",
      "processed_path": "assets/ready/hero2_norm.mp4"
    }
  ]
}
